tt0401398,Похождения императора 2: Приключения Кронка,"Не успели закончиться приключения Пачи и Императора Куско, как симпатяга Кронк, бывший слуга Измы, начал новую счастливую жизнь в качестве шеф-повара в своей собственной закусочной. Однако приключения начинаются с получением лама-граммы, согласно которой, его отец собирается прибыть с визитом. Но, не успев сообразить что происходит, Кронк умудряется состряпать уйму неприятностей, связавшись с хитрой колдуньей Измой, чтобы с помощью волшебства осветить себя ореолом успеха и процветания во время визита Папы. После целого ряда ошибок и грандиозного сырного взрыва в ресторане, проблемы кажутся неразрешимыми. Но с помощью друзей — как новых, так и старых — Кронк узнает, что любые трудности в жизни преодолимы."
tt0286502,Беспредел,"В исправительной колонии царят жестокие порядки, установленные администрацией и поддерживаемые среди заключенных с помощью воров в законе. Воровская «элита» творит свой суд и расправу над непокорными.Главный герой фильма не пожелал мириться с таким положение дел и вместе с несколькими заключенными, разделяющими его взгляды, попытался изменить беспросветную жизнь колонии. Противостояние двух неравных сил привело к бунту. Власти учинили новый беспредел и жестоко подавили стихийный протест заключенных..."
tt1314655,Дьявол,"Несколько людей, оказавшихся в застрявшем лифте, со временем понимают, что среди них присутствует сам дьявол."
tt1646876,16 желаний,"Эбби Дженсен планировала свое 16-летие с того момента как она была маленькой девочкой. Когда наступает этот день, она добавляет последнее (16-ое) желание в свой список желаний. К ее удивлению она получает коробку с 16-ю праздничными свечами, каждая из которых соответствует номеру ее желаний в списке. Как ее желания исполняются, ее день становится все лучше и лучше, пока она не загадает желание изменившее все и поможет себе понять что быть ребенком не так уж и плохо."
tt0230030,Ослепленный желаниями,"Дьявол еще никогда не был таким соблазнительным. В этот раз он принимает обличие распутной красотки, заставляющий любого мужчину броситься в объятия безумства. Неудачник-программист — лучший объект для вербовки. Объект продажи — бессмертная душа. Цена — 7 желаний. Но в этой жизни бесплатным бывает лишь сыр в мышеловке, каждая медаль имеет две стороны. Выполняя любое желание продажной души, дьявол не дает насладиться результатом. В мгновение ока жизнь программиста превращается в настоящий ад."
tt1656192,Отряд особого назначения,"Молодая французская журналистка похищена в Афганистане талибами. Правительство Франции отказывается выполнять условия похитителей. Тогда талибы размещают в Интернете жестокое видео с обратным отсчетом времени до ее казни. На выручку девушке отправляется элитный отряд французского спецназа. Но мало отбить жертву у бандитов, нужно еще вывести ее на Большую землю. Возвращение домой становится крестным путем и для гражданской журналистки, и для бывалых вояк-спецназовцев."
tt0395699,Лысый нянька: Спецзадание,"История о бывшем морском пехотинце, охраняющем работающего на правительство ученого и пятерых его детей. Как показывает практика, детей нужно охранять не только от злоумышленников, но и от них самих. Причем не следует забывать и о собственной безопасности. Их ведь пятеро, и все они чрезвычайно коварны..."
tt0248667,Али,"Непобедимый боксер Мухаммед Али является великим героем Америки, кумиром всего мира, и в то же время, одной из самых недооцененных персон XX века. Борясь за гражданские права в родной стране в сложные, бурные годы, когда громкие политические и социальные события коренным образом меняли мировоззрения людей, Али защищал угнетенных и дарил людям новую надежду. История сделала его живой легендой, и теперь вряд ли найдется на планете хоть один человек, который не слышал гордое имя Али."
tt0107048,День сурка,"Телевизионный комментатор Фил Коннорс каждый год приезжает в маленький городок в штате Пенсильвания на празднование Дня сурка. Но на этот раз веселье рискует зайти слишком далеко. Время сыграло с ним злую шутку: оно взяло да и остановилось."
tt1564367,Притворись моей женой,"Главный герой Дэнни встретил Палмер, и чтобы произвести впечатление, рассказал о своей несуществующей жене и тяготах семейной жизни. Вместо ожидаемого сочувствия, Палмер хочет познакомиться с его женой, и Дэнни необходимо срочно придумать, как выпутаться из столь интересного положения. К счастью, у него есть знакомая коллега Кэтрин, обаятельная и с детьми, которые и сыграют на время роль его семьи."
tt0970416,"День, когда Земля остановилась","Об инопланетянине, который прибыл на нашу планету с предупреждением: если не будут прекращены войны и разрушения, Земля будет уничтожена извне, поскольку представляет угрозу для остальной Вселенной!"
tt0099582,Коматозники,"Достаточно сделать всего один шаг, чтобы перейти хрупкую грань между жизнью и смертью. Группа студентов-медиков выбрала для своих исследований запретную и опасную область. Будущие врачи решили проникнуть в тайну небытия, которое наступает после остановки сердца. Один за другим студенты погружаются в состояние клинической смерти, отправляясь в непредсказуемое путешествие по ту сторону жизни. Результаты исследований оказались настолько неожиданными, что побывавший ТАМ уже не может продолжать прежний образ жизни, даже если бы и хотел."
tt1392170,Голодные игры,"Будущее. Деспотичное государство ежегодно устраивает показательные игры на выживание, за которыми в прямом эфире следит весь мир. Жребий участвовать в Играх выпадает юной Китнисс и тайно влюбленному в нее Питу. Они знакомы с детства, но теперь должны стать врагами. Ведь по нерушимому закону Голодных игр победить может только один из 24 участников. Судьям не важно кто выиграет, главное — зрелище. И на этот раз зрелище будет незабываемым."
tt0401729,Джон Картер,"Ветеран Гражданской войны в США Джон Картер против своей воли оказывается на Марсе, где попадает в плен к воинственным четырехметровым туземцам. Картеру предстоит не только спастись самому, но и спасти принцессу Дею Торис из Гелиума."
tt0182789,Двухсотлетний человек,"Экранизация одноименной повести Айзека Азимова. Начало нового тысячелетия; происходит прорыв в глобальных технологиях. Люди уже не заводят дома собак и кошек: они покупают себе роботов. Вот и семья Мартинов приобретает себе необычный подарок: робота нового поколения NDR-114, а в обычной жизни просто Эндрю. Купленный как прибор, запрограммированный для выполнения домашней работы, Эндрю вдруг начинает испытывать странные ощущения. Он еще не знает, что это называется чувствами."
tt1648112,Новые парни турбо,"Пятерых друзей увольняют из компании ввиду экономического кризиса. И они решают что с этого момента, мир не получит от них больше ни копейки. Они придут к вам, чтобы забрать все!!!"
tt0415678,Бой с тенью,"Артем Колчин был одним из многих, но он хотел славы. И он выбрал свой путь: он стал боксером. Теперь Артем претендент на чемпионский титул, боец, известный по всему миру, Большая Белая Надежда. Но главный бой в его жизни пошел не так, как он ожидал. Теперь ему предстоит решать свои проблемы вне ринга. У него всего три дня, чтобы расквитаться с теми, кто его предал, защитить любимую женщину от наемных убийц и собрать огромную сумму денег. В реальном мире бьют без перчаток и без правил. Вместо ринга — злые улицы большого города. И нет рефери, который может остановить бой. Но боец остается бойцом. Он знает, что такое страх, но способен не бояться. Он продолжает биться, даже когда надежда умерла. Счет идет на часы. И Артем начинает бой. За любовь. За друзей. За собственную жизнь."
tt0459759,Бой с тенью 2: Реванш,"Артем Колчин снова на ринге. Финальный бой за чемпионский титул он проведет в Америке. Но перед финалом ему предстоит бой с мексиканским боксером, который также рвется к вершине. После тяжелого поединка мексиканец умирает в госпитале. Но неприятности только начинаются. Артему сообщают, что он забил на ринге приемного сына мексиканского наркобарона, который вынес суровый приговор: кровь Вики за кровь погибшего сына. На свете есть только один человек, который может помочь Колчину выпутаться из опасной переделки, и он — заклятый враг Артема."
tt2097245,Бой с тенью 3: Последний раунд,"Боксер-чемпион Артем Колчин достиг всех мыслимых вершин и стал национальным героем. На ринг он больше не выходит, предпочитая тренерскую работу и бурную светскую жизнь с постоянным мельканием на ТВ, тусовками и интрижками. А дома его по утрам встречают дочка и жена Вика, которая больше не узнает в нем того Артема, которого она когда-то полюбила... Внешне благополучному существованию Колчина приходит конец, когда его подопечного чуть не убивает в бою знаменитый Куэрте. Артем подозревает, что тот использует некую запрещенную технику. За доказательствами ему приходится отправиться в Гонконг, где его ждет старый знакомый Вагит Валиев: он знает о Куэрте то, чего не знает больше ни один человек. Чтобы победить, Артему придется снова выйти на ринг."
tt0407304,Война миров,"Никто не поверил бы в начале 21 столетия, что за всем происходящим на Земле зорко и внимательно следят существа более развитые, чем человек; что в то время, как люди занимались своими делами, их исследовали и изучали. С бесконечным самодовольством сновали люди по всему земному шару, занятые своими делишками, уверенные в своей власти над материей. А между тем через бездну пространства на Землю смотрели глазами полными зависти, существа с высокоразвитым, холодным, бесчувственным интеллектом, и медленно, но верно вырабатывали свои враждебные нам планы..."
tt1374992,Параллельные миры,"Однажды, несколько тысяч лет тому назад, две планеты притянулись друг к другу. Там правили мир и гармония. Но стоило верхнему миру обрести уверенность и власть, как между планетами началось противостояние. Казалось, ничто не может примирить параллельные миры. Она — дочь президента верхнего мира. Эта хрупкая девушка с сильным характером и не подозревала, что душа ее способна любить. Он — ее половина. Их встреча была предопределена свыше, их судьбы переплелись воедино. Сможет ли Он, вопреки законам физики своего мира, быть вместе со своей любимой?"
tt1059786,На крючке,"Юный бездельник живет беззаботной жизнью, в отличие от своего брата-близнеца, стремящегося добиться успеха во всех сферах жизни, пока... тот не погибает при загадочных обстоятельствах. В то же время у матери-одиночки Рэйчел пропадает ребенок, и, вскоре, незнакомцы обнаруживают, что их подставили и выставили террористами. Насильно внедренные в группировку, планирующую серию убийств, они вынуждены вместе искать пути к спасению своей жизни..."
tt1217209,Храбрая сердцем,"Испокон веков мифы и легенды окутывают загадочной пеленой живописные отроги Шотландских гор. Искусной лучнице Мериде приходится выбирать свой путь в жизни самостоятельно, и однажды она отказывается следовать древним традициям королевства, бросая вызов могущественным шотландским кланам и их предводителям: нескладному лорду МакГаффину, угрюмому лорду Макинтошу и сварливому лорду Дингволлу. Неосторожные поступки Мериды грозят повергнуть королевство в хаос, и тогда она отправляется за советом к эксцентричной отшельнице, которая вместо помощи накладывает на Мериду опасное заклятье. Юной принцессе предстоит полагаться только на собственную храбрость, чтобы преодолеть могущественное волшебство и победить самого страшного зверя из тех, что водятся в горных долинах..."
tt0205000,Мужчина по вызову,"Дьюс Бигало, вечно нищий чистильщик водоемов, которому к тому же с девушками не везет, является по вызову (пруд приусадебный почистить) к одному богатому и красивому, который в числе прочего рассказывает, как он на жизнь зарабатывает: мужской проституцией. И уезжает в командировку. А Дьюса оставляет по хозяйству — подмести там, за рыбкой больной поухаживать. И вот живет Бигало в роскошном домище, а телефон звонит не переставая — одинокие женщины любви алчут. И, ясное дело, Дьюс начинает карьеру мальчика по вызову. Ну, мальчика — это сильно сказано, скорее низенького дяденьки по вызову."
tt0367652,Мужчина по вызову 2,"Дьюс отправляется по приглашению своего бывшего сутенера на отдых в Амстердам и в итоге понимает, что его вновь хотят вернуть в бизнес эскорт услуг для женщин. Не то, чтобы Дьюс был против — платят неплохо, но, во-первых, у него уже есть постоянная подружка, а во-вторых, у европейских женщин слишком бурная сексуальная фантазия..."
tt1386703,Вспомнить всё,"Он — обычный рабочий-строитель, живущий в маленькой квартирке в захудалом районе города будущего где-то в Новой Азии. Хотя собственная жизнь его в целом устраивает, он не может избавиться от чувства, что ему хочется чего-то большего. Потребность в новых будоражащих впечатлениях приводит его в офис компании «Вспомнить всё», имплантирующей в память своих клиентов воспоминания-фантазии, которые они могут получить не рискуя при этом пережить сами события в реальности. Пока герой выбирает, какие именно воспоминания ему приобрести, отряд спецназа штурмует комнату, где он находится, и уже было берет его под арест. К своему собственному удивлению, он молниеносно уничтожает весь отряд при помощи невероятных бойцовских навыков, о владении которыми он и не подозревал..."
tt1907668,Экипаж,"Опытный пилот Уип Вайтекер чудом избегает крушения самолета, и, совершив аварийную посадку, сохраняет жизни практически всех пассажиров. Уипа чествуют, как героя, но чем больше появляется подробностей о катастрофе, тем больше вопросов возникает: что же на самом деле произошло на борту самолёта... История напоминает очень похожие события, произошедшие в настоящей жизни в 2001 году, когда канадский капитан Роберт Пише посадил самолет Airbus 330, у которого отказали оба двигателя, и при этом спас 306 пассажиров от неминуемой смерти. Буквально за одну ночь став героем, он быстро познал обратную сторону медали, когда журналист выставил на показ его давно забытое криминальное прошлое и личную жизнь. Однако самолет не летал перевернутым. Фильм отражает историю его жизни, а не сам случай посадки самолета."
