tt1192628,Ранго,"Ранго — хамелеон, который живет в террариуме и считает себя героем, которому, к сожалению, никак не удается проявить свое бесстрашие. Но когда он внезапно оказывается в городке Грязь, у него появляется такая возможность. Ранго провозглашает себя борцом за справедливость и начинает вести себя как шериф на Диком Западе. Он еще не знает, что быть «хорошим парнем» в этих краях не самая завидная участь..."
tt1219289,Области тьмы,"Нью-йоркский писатель Эдди, желая преодолеть чёрную полосу в жизни, принимает засекреченный препарат под названием NZT. Таблетка выводит мозг парня на работу в нереальной мощности. Этот творческий наркотик меняет всю жизнь Эдди, за короткий срок он зарабатывает кучу денег, но скоро начинает страдать от зловещих побочных эффектов препарата. А когда пытается найти других NZT-гениев, чтобы понять, как можно справиться с этим пристрастием, он узнает страшную правду..."
tt1682187,Выкрутасы,"Слава Колотилов, простой школьный учитель из сонного приморского городка с небанальным названием «Пальчики», приехал покорять Москву с рукописью романа в руках, а покорил... красавицу Надю. Уже близится свадьба, ресторан заказан и гости приглашены, но цепкие Пальчики не дают Славе вырваться к суженой, подстраивая череду «непреодолимых обстоятельств». Вот и приходится Славе выкручиваться, рассказывая Наде по телефону небылицы о страшных происшествиях и катастрофах. А в далёкой Москве в это время Надя отбивает атаки своего бывшего ухажера Дани, готового пойти на любые выкрутасы, лишь бы вернуть себе невесту..."
tt0115798,Кабельщик,"Чип Дуглас, кабельщик, - парень со странностями. Познакомившись со Стивеном Ковачем, он хочет стать его лучшим другом. Узнав Чипа поближе, Стивен понимает, что эта дружба чревата последствиями - шуточный поединок, например, перерастает в бой боксеров среднего веса. Решив избавиться от такого «друга», он вдруг осознает, что это будет совсем не просто. «Я могу быть твоим лучшим другом... или самым страшным врагом» - это сказал Чип. И Стивен знает, что тот не шутит."
tt0389790,Би Муви: Медовый заговор,"Барри Би Нельсон — пчелка, только что закончившая колледж и весьма разочарованная дальнейшей карьерой. Ведь единственный выбор, открывающийся перед ней — сбор меда. Отправившись куда глаза глядят, Барри попадает в передрягу, из которой его вызволяет Ванесса, нью-йоркская цветочница. Барри немедленно влюбляется в спасительницу, и перебирается жить поближе к ней. Именно в Нью-Йорке он узнает, что мед, который с таким трудом добывают пчелы, люди съедают. И Барри решает предъявить человечеству иск."
tt0435705,Пророк,"У Криса Джонсона есть секрет, отравляющий его жизнь: он может предсказывать ближайшее будущее. Устав от бесконечного внимания правительства и медицинских центров, пытающихся разгадать природу его удивительных способностей, Крис ложится на дно. Под вымышленным именем он работает в Лас-Вегасе, где развлекает публику дешевыми фокусами. Но когда группа террористов угрожает Лос-Анджелесу, специальному агенту Калли Феррис придется собрать все силы, чтобы разыскать Криса и убедить его помочь предотвратить катастрофу."
tt1433108,Быстрее пули,"После десяти лет, проведенных в тюрьме, у Драйвера одна цель: выследить и уничтожить людей, замешанных в жестоком убийстве его брата. Наконец-то обретя свободу, он готов пойти на все, чтобы выполнить свою жестокую миссию и разделаться с теми, кто попал в его черный список. Испытать радость отмщения Драйверу мешают полицейский-ветеран и наемный убийца, каждый из которых имеет свою причину свести с ним счеты. Теперь охота ведется на охотника..."
tt0297814,Брюс Ли: Путь Воина,"Его знаменитый одно-дюймовый удар мог свалить с ног. Он мог отжиматься на одном пальце. Все это вы сможете увидеть в фильме Брюс Ли: Путь воина. Впервые вы сможете увидеть что-то поразительное: более 30 минут боя в амбициозном, обнажающем душу фильме, который делал Ли, когда погиб 20 июля 1973 года. Джон Литтл работал с бесценным киноматериалом, который никто не видел 28 лет. Частично документальный (с неизвестными прежде домашними съемками Ли), частично – художественный ( с утраченными когда-то кусками, составленными вместе согласно записям, найденным в личных вещах) и незабываемый Брюс Ли: Путь воина – ценнейший подарок каждому поклоннику Ли."
tt0455824,Австралия,"История английской аристократки леди Сары Эшли (Н.Кидман), рассказанная от лица мальчика-аборигена Налла (Б.Уолтерс). После гибели мужа она получила в наследство огромное ранчо под названием «Далёкие Низины» (Faraway Downs) на севере австралийского материка. С началом Второй мировой войны она приезжает в имение для того, чтобы уберечь его от попыток английских скотоводов заполучить ранчо в свою собственность. Ей приходится при помощи гуртовщика Дровера (Х.Джекман) и добровольцев-слуг перегнать 1500 голов скота через тысячи миль в центр Северной Территории – город Дарвин для продажи их интендантам армии. Нил Флетчер (Дэвид Венхэм) и группа гуртовщиков, которых Сара Эшли до этого уволила, пытаются погубить её стадо, чтобы отработать плату, полученную ими от её главного конкурента Кинга Карни (Б.Браун). Через несколько лет герои фильма попадают под массированные бомбардировки японских военно-воздушных сил..."
tt0426931,Август Раш,"Яркая личность – молодой гитарист из Ирландии – влюбился в красивую американскую виолончелистку, дочь известных родителей. А она ответила ему взаимностью. В их жизни произошла незабываемая встреча в Нью-Йорке, после чего судьба разлучила влюбленных. Плод их любви – ребенок Август Раш по той же прихоти судьбы оказался в нью-йоркском приюте. Через двенадцать лет Август Раш благодаря огромному таланту становится неординарным музыкантом. Он мечтает найти своих родителей. И думает, что в этом ему поможет музыка. Музыка, по которое его родители догадаются, что он – их сын. У юного музыканта появляется опекун – таинственный незнакомец. Под его опекой Август и начинает играть на улицах большого города в надежде благодаря выдающимся музыкальным способностям встретить родителей, которых никогда прежде не видел..."
tt1013743,Рыцарь дня,"Случайная встреча в аэропорту одинокой женщины Джун Хэвенс и обаятельного агента Миллера приводит к тому, что им приходится вместе колесить по всему свету, спасаясь от наемных убийц и пытаясь уберечь от коварных злодеев мощную батарею, которая является уникальным источником энергии. Попадая в бесчисленные передряги и постоянно находясь на волоске от смерти, Джун все время мучается в догадках, кто же на самом деле ее неугомонный спутник - спаситель человечества, предатель или просто-напросто сумасшедший..."
tt1436562,Рио,"Красивый и очень недалёкий попугай, родившийся в неволе в небольшом городке штата Миннесота, улетает в поисках приключений, на родину предков, в Рио-де-Жанейро."
tt0268978,Игры разума,"От всемирной известности до греховных глубин — все это познал на своей шкуре Джон Форбс Нэш-младший. Математический гений, он на заре своей карьеры сделал титаническую работу в области теории игр, которая перевернула этот раздел математики и практически принесла ему международную известность. Однако буквально в то же время заносчивый и пользующийся успехом у женщин Нэш получает удар судьбы, который переворачивает уже его собственную жизнь..."
tt1502404,Сумасшедшая езда,"Однажды утром в безымянном городишке появляется незнакомец, явно не вписывающийся в добропорядочную среду пуританской Америки. Он пользуется успехом у женщин, предпочитает потреблять крепкие спиртные напитки из горла и таскает с собой целый арсенал, от дробовика до весьма впечатляющего пятиствольного обреза ручной работы. Незнакомца зовут Джон Милтон, и он явно не собирается соблюдать какие-либо законы или соответствовать принятым нормам общения. Он прибыл в эту местность отнюдь не случайно. Прибыл оттуда, откуда обычно уже не возвращаются. Милтон не понаслышке знает о существовании преисподней. Покинув Ад, Джон собирается вернуть должок убийцам его родной дочери и попытаться спасти свою внучку из лап секты поклонников Дьявола. Их предводитель, богомерзкий Джона Кинг, планирует принести ребенка в жертву, чего Милтон никак не может допустить. Главная проблема Милтона состоит в том, что за ним из преисподней на Землю последовал еще более мрачный, хоть и не лишенный саркастического юмора, персонаж – счетовод Дьявола, в задачу которого входит немедленное возвращение беглеца обратно в котел. И если методы Милтона покажутся вам излишне жестокими и прямолинейными, то его преследователь вообще не привык слышать отрицательных ответов..."
tt0978764,Запрещенный прием,"Действие развернется в 1950 году. Молодую девушку по настоянию ее злодейского отчима определяют в больницу для душевнобольных, где спустя пять дней главную героиню лоботомируют. Чтобы оградиться от боли, она выдумывает сказочный мир, где и начинает планировать свой побег — для этого ей нужно раздобыть пять предметов."
tt0277296,Царь Скорпионов,"""Воин. Легенда. Король"" Эта история произошла 5 тыс. лет назад в Египте, еще задолго до постройки первых пирамид. Злой правитель и могущественный воин Мемнон решил поработить все народы, живущие в пустыне. Со своей многочисленной армией Мемнон выигрывает одно сражение за другим. Удача сопутствует жестокому злодею, потому что все злодеяния Мемнон совершает, опираясь на предсказания своего провидца. Осталась только горстка непокорных народов в пустыне, которые еще противостоят власти Мемнона. Немногие оставшиеся племена нанимают воина акадца Метаеса — человека убивающего за деньги — чтобы тот убил провидца Мемнона. Оказавшись во вражеском лагере, Метаес к своему удивлению обнаруживает, что ясновидец — это красивая молодая женщина Кассандра. Он оставляет ее в живых и берет с собой в пустыню, чтобы выманить Мемнона из его города-крепости Гоморры. Единственное, что может успокоить теперь Метаеса — это смерть Мемнона..."
tt1104123,Царь Скорпионов 2: Восхождение воинов,"Молодой Масьюз видит смерть своего отца, самого великого воина его народа. Всем известно кто убил его. Годы проходят и Масьюз становится воином Черным Скорпионом, готовым служить своему царю, человеку, что убил его отца. Как его остановить, если царь - владеет черной магией и поддержкой Богини Смерти. Масьюз встретится с Минотавром и попадет в Подземный мир и все ради мести."
tt0800369,Тор,"Художественный фильм режиссёра Кеннета Брана, основанный на одноимённых комиксах издательства Marvel Comics. Созданием картины занималась компания Marvel Studios, а распространением Paramount Pictures. Главный герой фильма — Тор, высокомерный и гордый бог грома, — был лишён своей силы и изгнан из Асгарда — одного из девяти миров. Оказавшись на Земле, он знакомится с молодым доктором Джейн Фостер, с которой у него развиваются отношения. Кроме того, Тор должен остановить своего брата Локи, который намерен стать новым царём Асгарда. Картина стала частью кинематографической вселенной Marvel, фильмы которой объединяются в общую сюжетную линию."
tt0822847,Пастырь,"В дни, когда тьма накрывала горизонт и в тишине ночи раздавались пугающие людей звуки, под крышей слышалось шуршание чужих шагов, а утром люди обнаруживали своих соседей мертвыми – они шли в церковь. Ведь это церковь всегда была для людей убежищем, утешением и защитой. И теперь вновь стала главной опорой человеческой цивилизации. Во времена, когда злобные твари убивают все живое, противное их природе или же превращает в рабов, послушных хозяйской воле. Древняя раса вампиров, однажды побежденная, вновь расширяет влияние. И только великие воины, освященные божьим благословением, могут выйти на битву с ними. И имя им – пастыри. Но как же сражаться, если в существование врага не верит никто и совет церкви считает лишь домыслами тревожные слухи, пришедшие с дальних рубежей государства?"
tt0328107,Гнев,"Джон Кризи, бывший наемник, за его плечами огромное количество выполненных спецопераций в разных горячих точках планеты. Очень сложно представить, что пришлось пережить человеку у которого теперь нет родных, семьи, ни детей, ни жены. Раньше Джон убивал не только солдат, но и женщин и детей. Теперь он ищет успокоение в стакане со спиртом и в Библии. Никто и не мог подумать, что к жизни его вернет одиннадцатилетняя девочка, которую он нанялся охранять. Со временем жизнерадостная и общительная Пита становится для своего телохранителя не простой работой, но и настоящим другом. Джон поистине испытывал искренние отцовские чувства к девчушке. Но однажды ее похитители злоумышленники. И теперь у Кризи есть дело всей его жизни — найти и отомстить..."
tt1591095,Астрал,"Джош и Ринэй переезжают со своими детьми в новый дом, но не успевают толком распаковать вещи, как начинаются странные события. Необъяснимо перемещаются предметы, в детской звучат странные звуки... Но в настоящий ужас приходят родители, когда их десятилетний сын Далтон впадает в кому. Все усилия врачей в больнице помочь мальчику безуспешны. Несколько месяцев спустя его возвращают домой, где за несчастным ребенком ухаживают мать и сиделка. Но загадочные явления в доме продолжаются. Отчаявшиеся родители готовы обратиться за помощью к кому угодно и вскоре выясняется, что Далтон в бессознательном состоянии связан с паранормальным миром..."
tt1092026,Пол: Секретный материальчик,"Два друга из Англии — Грэм и Клайв, колесят по Штатам, посещают всякие места связанные с пришельцами. Как то ночью парням довелось наблюдать за сценой аварии. Остановившись посмотреть жив ли кто, видят инопланетянина. Клайв падает в обморок, обмочив штаны. После выясняется, что инопланетянина зовут Пол и он нуждается в помощи. Пол рассказывает своим новым друзьям о том, что в далеком 47 году он разбился на своей летающей тарелке и все это время он пробыл в правительственном бункере. Теперь за Полом гоняются федералы, которым инопланетянин нужен в виде лабораторной крысы. Пол направляется в то место, в котором инопланетные собратья смогут забрать его на родину. Грэм и Клайв становятся спасательной соломинкой для милого и забавного Пола..."
